"Type","Policy Document ID","Title","Translated title","Source title","Source country","Source type","Source sub-type","Published on","Cited research titles","Cited research DOIs","Topics","Document URL","Text"
"Policy citation","ipeabr-aef2dbf6333c4a606c37d5bc9debf212","Agricultura e diversidades : trajetórias， desafios regionais e políticas públicas no Brasil : v. 2","Agriculture and diversity: trajectories， regional challenges and public policies in Brazil: v. 2","Instituto de Pesquisa Econômica Aplicada","Brazil","think tank","","2025-03-01","Perception of the operating agents about the Brazilian National School Feeding Program","10.11606/s1518-8787.2019053000597","Agriculture  ，Pará  ，Economics  ，Water  ，Brazil  ，Northeast Region  ， Brazil  ，Literacy  ，Agribusiness  ，Irrigation  ，Sustainability  ，Irrigation in Brazil  ，Brazilian Institute of Geography and Statistics  ，Correlation  ，Bahia  ，Scarcity  ，Water scarcity  ，Pesticide  ，Agriculture in Brazil  ，North Region  ， Brazil  ，Law  ，Drainage basin  ，Southeast Region  ， Brazil  ，Education  ，Drought  ，Primary education  ，Afro-Brazilians  ，Minas Gerais  ，Sugarcane  ，South Region  ， Brazil  ，Maize  ，Governance  ，Credit  ，Brasília  ，Santos  ， São Paulo  ，Natural environment  ，Desertification  ，White people  ，Black people  ，Urban agriculture  ，Cost  ，Central-West Region  ， Brazil  ，São Francisco River  ，Productivity  ，Census  ，Alagoas  ，Race (human categorization)  ，State (polity)  ，Petrolina  ，Research  ，Planning  ，Technology  ，Public policy  ，Externality  ，South America  ，Academic degree  ，White Brazilians  ，Government procurement  ，Decentralization  ，Federative units of Brazil  ，Municipality  ，Learning  ，Federation  ，Tax  ，Market (economics)  ，Adult education  ，COVID-19 pandemic in Brazil  ，Social policy  ，Subdivisions of Brazil  ，Tertiary sector of the economy  ，Organizational learning  ，Budget  ，Public service  ，Family  ，COVID-19 pandemic  ，Social work  ，Economy  ，Food security  ，Outsourcing  ，Evolution","https://www.ipea.gov.br/portal/publicacao-item?id=ec34c71b-cc98-48fc-bdd3-219947cf1506",""
"Policy citation","piebr-c82636ada5017b6bd2f856b39dd46c01","Implementação de programas e políticas públicas de saúde em municípios brasileiros","Implementation of public health programs and policies in Brazilian municipalities.","Políticas Informadas por Evidências (PIE)","Brazil","government","","2024-10-02","Desafios da intersetorialidade nas políticas públicas: o dilema entre a suplementação nutricional e a promoção da alimentação saudável em escolas","10.1590/0102-311x00035218","Prenatal care  ，Dentistry  ，Sistema Único de Saúde  ，Nursing  ，Health  ，Breastfeeding  ，Education  ，Municipality  ，Minas Gerais  ，Paraná (state)  ，Health promotion  ，Porto Alegre  ，Human resource management  ，Construction  ，Condom  ，Mais Médicos  ，Corumbá  ，Syphilis  ，Child  ，Planning  ，Women's health  ，Family  ，Mental health  ，Belo Horizonte  ，Brazil  ，Epidemiology  ，Birth control  ，Diabetes  ，Programa Saúde da Família  ，HIV/AIDS  ，City  ，São Paulo (state)  ，Programa de Aceleração do Crescimento  ，Primary health care  ，São Paulo  ，Public policy  ，Pedagogy  ，Rio Grande do Sul  ，Sustainability  ，Strategy  ，Adolescence  ，Brasília  ，Tuberculosis  ，Community health agent  ，Alagoas  ，Araraquara  ，Nutritionist  ，Research  ，Health care  ，Time  ，Pregnancy  ，Sexually transmitted infection  ，Woman  ，Investment  ，Rio de Janeiro  ，Early childhood education  ，Hypertension  ，Decentralization  ，State (polity)  ，Physics  ，School  ，Barreiras  ，Budget  ，Recife  ，Non-communicable disease","https://sites.bvsalud.org/pie/pt/biblio/resource/?id=biblioref.referencesource.1572539",""
"Policy citation","ipeabr-e66387a2159a16b372313daa5e692f42","Planejamento e Políticas Públicas (PPP): n.65， jan/.mar. 2023","","Instituto de Pesquisa Econômica Aplicada","Brazil","think tank","","2024-03-01","Desafios da intersetorialidade nas políticas públicas: o dilema entre a suplementação nutricional e a promoção da alimentação saudável em escolas","10.1590/0102-311x00035218","Brazil  ，Preschool  ，Scientific method  ，Planning  ，Child  ，Municipality  ，Education  ，Research  ，Time  ，Branches of science  ，Content analysis  ，Health  ，Public policy  ，World Health Organization  ，Communication  ，UNICEF  ，Alagoas  ，Politics  ，Learning  ，Information  ，Training  ，Probability distribution  ，Gender  ，Market (economics)  ，Economics  ，COVID-19 pandemic  ，Labour economics  ，Economic inequality  ，Quantile function  ，Adolescence  ，Average  ，White people  ，Median  ，Sampling (statistics)  ，Brazilian Institute of Geography and Statistics  ，Equation  ，Economy  ，Estimator  ，Evidence  ，2014 Brazilian economic crisis  ，Salary  ，Southeast Region  ， Brazil  ，Northeast Region  ， Brazil  ，Black people  ，Microeconomics  ，Economic growth  ，Income  ，Function (mathematics)  ，Methodology  ，Empiricism  ，Gross domestic product  ，Man  ，Normal distribution  ，Brazilians  ，Sociology  ，Unemployment  ，Standard deviation","https://www.ipea.gov.br/portal/publicacao-item?id=8b6e134f-9215-4d35-ad6e-48eca0577ef8",""
"Policy citation","who-efa851e1ffdaf37f02e8307271b49871","Рамочная схема действий по разработке и осуществлению политики в области государственных закупок продовольствия и услуг питания для обеспечения здорового пищевого рациона","Framework for action to develop and implement public procurement policies for food and nutrition services to ensure healthy diets","World Health Organization","IGO","igo","","2024-01-01","Purchases from family agriculture for school feeding in Brazilian capitals","10.11606/s1518-8787.2020054001963","Food  ，Hors d'oeuvre  ，Health  ，Creative Commons license  ，Sustainable Development Goals  ，Healthy diet  ，Vegetable  ，Trans fat  ，World Health Organization  ，Agriculture  ，CountrySTAT  ，Cardiovascular disease  ，Sugar  ，Israel  ，Disease  ，Obesity  ，United States  ，Salt  ，United Nations  ，Health care  ，License  ，Logistics  ，Hypertension  ，Triglyceride","https://apps.who.int/iris/handle/10665/376794",""
"Policy citation","paho-1f49ae67a0f0df44d0c0e3669b9ad853","Marco de acción para formular y aplicar políticas de compras y servicios de alimentos en el sector pública para promover una alimentación saludable","Framework for action to formulate and implement food purchasing and service policies in the public sector to promote healthy eating","Pan American Health Organization (PAHO)","IGO","igo","","2023-11-16","Purchases from family agriculture for school feeding in Brazilian capitals","10.11606/s1518-8787.2020054001963","Food  ，Nutrition facts label  ，Nutrition  ，Politics  ，Health  ，Sustainable Development Goals  ，Food safety  ，Food labelling and advertising law (Chile)  ，Sustainability  ，Malnutrition  ，Food system  ，Nutrient  ，Meat  ，Agriculture  ，Marketing  ，Evaluation  ，Cereal  ，Food and Agriculture Organization  ，Food and drink  ，Vegetable  ，Salt  ，Consumption (economics)  ，Obesity  ，Hospital  ，Non-communicable disease  ，Fat  ，Soft drink  ，Society  ，Non-governmental organization  ，Creative Commons license  ，Brazil  ，Water  ，Productivity  ，Public health  ，Governance  ，Legume  ，Institution  ，Human rights  ，Dessert  ，Law  ，Creative Commons  ，Drink  ，World Health Organization  ，Manufacturing  ，Food watchlist articles  ，Bread","https://iris.paho.org/handle/10665.2/58553",""
"Policy citation","who-4116cb0408e0c66d78cee38a29a31881","Cadre d’action pour l’élaboration et la mise en oeuvre de politiques publiques en matière d’achat de denrées alimentaires et de services de restauration pour une alimentation saine","Framework for action for the development and implementation of public policies on the purchase of foodstuffs and catering services for healthy diets","World Health Organization","IGO","igo","","2022-10-21","Purchases from family agriculture for school feeding in Brazilian capitals","10.11606/s1518-8787.2020054001963","Food  ，Nutrition facts label  ，Dietitian  ，Sustainable Development Goals  ，Health  ，Cantina  ，Sustainable development  ，Agriculture  ，Sugar  ，Nutrition  ，Vegetable  ，Obesity  ，Drink  ，Purchasing  ，Food security  ，Malnutrition  ，Meal  ，Public policy  ，Eating  ，Non-communicable disease  ，Breakfast  ，Food and drink  ，Sustainable Development Goal 2  ，Trans fat  ，Salt  ，Politics  ，Governance  ，Natural environment  ，Consumption (economics)  ，Public health  ，Media (communication)  ，World Health Organization  ，Stakeholder (corporate)  ，Conflict of interest  ，Meat  ，Cuisine  ，Sauce  ，Nutrient  ，Hypertension  ，Research","https://apps.who.int/iris/handle/10665/363695",""
"Policy citation","who-1803a0a50df90ab2da550c5e57476d91","Implementing school food and nutrition policies: a review of contextual factors","","World Health Organization","IGO","igo","","2021-09-14","Perception of the operating agents about the Brazilian National School Feeding Program","10.11606/s1518-8787.2019053000597","School meal  ，Food  ，Obesity  ，National School Lunch Act  ，Systematic review  ，Health  ，Healthy diet  ，Human nutrition  ，Right to food  ，Non-communicable disease  ，World Health Organization  ，Right to health  ，Food choice  ，Behavior  ，International Covenant on Economic  ， Social and Cultural Rights  ，Diet (nutrition)  ，Food security  ，Human activities  ，Nutrition  ，Food and drink  ，Childhood obesity  ，Food policy  ，Soft drink  ，School  ，Malnutrition  ，Junk food  ，Policy  ，Socioeconomic status  ，Vegetable  ，Economic  ， social and cultural rights  ，Dietary fiber  ，Human rights  ，Poverty  ，Social equality  ，Fast food restaurant  ，Adolescence  ，Universal Declaration of Human Rights  ，Fat  ，Public health  ，Value (ethics)  ，Convention on the Rights of the Child  ，Drink  ，Children's rights  ，Education  ，Teacher  ，Child  ，Whole grain  ，United Nations","https://apps.who.int/iris/handle/10665/345130",""
"Policy citation","who-92892abff88911e6fc64ee7f4f75c29e","Action framework for developing and implementing public food procurement and service policies for a healthy diet","","World Health Organization","IGO","igo","","2021-01-11","Purchases from family agriculture for school feeding in Brazilian capitals","10.11606/s1518-8787.2020054001963","Vegetable  ，Food  ，Health  ，Healthy diet  ，School meal  ，Dietary Guidelines for Americans  ，Government procurement  ，Policy  ，Sustainability  ，Diet (nutrition)  ，Nutrition facts label  ，Evaluation  ，Regulatory compliance  ，Fat  ，Malnutrition  ，Sustainable Development Goals  ，Agriculture  ，Non-communicable disease  ，Procurement  ，Monitoring and evaluation  ，Supply chain  ，Food safety  ，Saturated fat  ，Nutrient  ，Cardiovascular disease  ，Snack  ，Convenience food  ，Cooking  ，Junk food  ，Meal  ，Public health  ，World Health Organization  ，Human activities  ，Food and drink  ，Sustainable diet  ，Governance  ，Obesity  ，Sugar  ，Target audience  ，Creative Commons license  ，Soft drink  ，Health in All Policies  ，Purchasing  ，Food marketing  ，Whole grain  ，Local food  ，Hunger  ，Mass media  ，Meat  ，Synergy  ，Dessert  ，Drink  ，Educational assessment  ，Food security  ，Food system  ，Inspection  ，Salt  ，Cookie  ，Goal  ，Cafeteria  ，Information  ，Good governance","https://apps.who.int/iris/handle/10665/338525",""